{
  "schema_version": 1,
  "verification_id": "verification:22222222222222222222222222222222",
  "request_id": "verify-request:11111111111111111111111111111111",
  "discovery_id": "discovery:icml:2026:001",
  "venue_id": "icml",
  "year": 2026,
  "verified_at": "2026-07-13T17:31:00Z",
  "overall_status": "verified",
  "source_observations": [
    {
      "source_id": "source:icml:2026:001",
      "url": "https://icml.cc/virtual/2026/calendar",
      "source_trust": "official",
      "policy_decision": "allowed",
      "policy_domain": "icml.cc",
      "permission": "metadata_fetch",
      "fetch_status": "fetched",
      "http_status": 200,
      "snapshot_id": "snapshot:33333333333333333333333333333333",
      "observed_at": "2026-07-13T17:31:00Z",
      "reason_code": "source_observed"
    }
  ],
  "findings": [
    {
      "finding_id": "finding:icml:2026:list",
      "target_kind": "claim",
      "target_id": "claim:icml:2026:list",
      "verification_kind": "paper_list",
      "status": "verified",
      "source_ids": ["source:icml:2026:001"],
      "evidence_ids": ["snapshot:33333333333333333333333333333333"],
      "reason_code": "supported",
      "metrics": {"paper_count": 3}
    }
  ],
  "verified_facets": {
    "conference_status": null,
    "paper_list_status": {
      "value": "released",
      "evidence_ids": ["snapshot:33333333333333333333333333333333"]
    },
    "metadata_status": null,
    "pdf_status": null,
    "proceedings_status": null
  },
  "verified_milestones": [
    {
      "candidate_milestone_id": "milestone:icml:2026:end",
      "milestone_type": "conference_end",
      "scope": "conference",
      "date": "2026-07-18",
      "source_type": "official",
      "source_url": "https://icml.cc/virtual/2026/calendar",
      "evidence_ids": ["snapshot:33333333333333333333333333333333"]
    }
  ],
  "uncertainties": [],
  "evidence_fingerprint": "bbbbbbbbbbbbbbbbbbbbbbbbbbbbbbbbbbbbbbbbbbbbbbbbbbbbbbbbbbbbbbbb"
}
